{
  "$schema": "https://json-schema.org/draft/2020-12/schema",
  "$id": "https://omca.dev/schemas/domain/binding.v1alpha1.schema.json",
  "title": "Binding v1alpha1",
  "description": "Selects Profiles for a context. Does not establish host precedence (docs/product/requirements.md §4.2).",
  "type": "object",
  "additionalProperties": false,
  "required": ["apiVersion", "kind", "metadata", "spec"],
  "properties": {
    "apiVersion": { "$ref": "common.v1alpha1.schema.json#/$defs/apiVersion" },
    "kind": { "const": "Binding" },
    "metadata": {
      "type": "object",
      "additionalProperties": false,
      "required": ["id"],
      "properties": {
        "id": { "type": "string", "minLength": 1 }
      }
    },
    "spec": {
      "type": "object",
      "additionalProperties": false,
      "required": ["match", "profiles"],
      "properties": {
        "match": {
          "type": "object",
          "additionalProperties": false,
          "description": "Exactly one of repository or repositoryGlob must be set -- mutually exclusive alternatives for naming which repository context(s) this Binding selects, not independent filters. repository (the original, still-fully-supported mode) requires an exact match; repositoryGlob (issue: closes the 'apply to every checkout under a prefix, e.g. ~/workspace/**, including worktrees created later' gap that one Binding = one literal repository could not express) matches via the same doublestar-style '**'/'*' segment grammar paths already uses.",
          "properties": {
            "repository": { "type": "string", "minLength": 1 },
            "repositoryGlob": { "type": "string", "minLength": 1 },
            "paths": {
              "type": "array",
              "items": { "type": "string" }
            }
          },
          "oneOf": [
            { "required": ["repository"], "not": { "required": ["repositoryGlob"] } },
            { "required": ["repositoryGlob"], "not": { "required": ["repository"] } }
          ]
        },
        "profiles": {
          "type": "array",
          "items": { "type": "string" },
          "minItems": 1
        }
      }
    }
  }
}
